{
  "$schema": "http://json-schema.org/draft-07/schema#",
  "title": "ChildState",
  "description": "Raw child state per ADR-004. Exactly two raw pockets: topic_mastery and interests. Capability scores are DERIVED views (topic-derived aggregation + capped direct evidence), never stored.",
  "type": "object",
  "required": ["child_id", "age", "stage"],
  "properties": {
    "child_id": {
      "type": "string"
    },
    "age": {
      "type": "number",
      "minimum": 3,
      "maximum": 12
    },
    "stage": {
      "type": "string",
      "enum": ["early_childhood", "middle_childhood"]
    },
    "interests": {
      "type": "object",
      "description": "Interest label -> weight 0..1. Seeded taxonomy + controlled emergence (child labels hang under seed labels). Updated by evidence EMA.",
      "additionalProperties": {
        "type": "number",
        "minimum": 0,
        "maximum": 1
      }
    },
    "topic_mastery": {
      "type": "object",
      "description": "Sparse map: topic id (mt_...) -> mastery record. Absent topics fall back to an age-based prior; they are not stored.",
      "additionalProperties": {
        "type": "object",
        "required": ["mastery", "confidence", "evidence_count"],
        "properties": {
          "mastery": {
            "type": "number",
            "minimum": 0,
            "maximum": 1
          },
          "confidence": {
            "type": "number",
            "minimum": 0,
            "maximum": 1,
            "description": "Grows with evidence count; scales EMA step size."
          },
          "evidence_count": {
            "type": "integer",
            "minimum": 0
          },
          "last_evidence_at": {
            "type": "string",
            "format": "date-time"
          }
        }
      }
    },
    "capability_direct": {
      "type": "object",
      "description": "Sparse map: capability id -> direct-evidence accumulator. SECONDARY channel only (ADR-004 §4): evidence with no honest topic anchor. evidence_strength for this channel is capped at 0.5. Final capability score = topic-derived aggregate fused with this channel.",
      "additionalProperties": {
        "type": "object",
        "required": ["level", "confidence", "evidence_count"],
        "properties": {
          "level": {
            "type": "number",
            "minimum": 0,
            "maximum": 1
          },
          "confidence": {
            "type": "number",
            "minimum": 0,
            "maximum": 1
          },
          "evidence_count": {
            "type": "integer",
            "minimum": 0
          },
          "last_evidence_at": {
            "type": "string",
            "format": "date-time"
          }
        }
      }
    }
  }
}
